{
  "address": {
    "uuid": "11111111-1111-1111-1111-111111111111",
    "handle": "paper/sample",
    "type": "paper"
  },
  "source": {
    "path": "canon-store/sources/sample.md",
    "sha256": "sha256:0000000000000000000000000000000000000000000000000000000000000000"
  },
  "metadata": {
    "title": "Sample Paper",
    "author": "Unknown",
    "domain": "theology",
    "series": "sample-series"
  },
  "runs": [],
  "latest_run": null,
  "extracted": {
    "ckg": {},
    "atoms": [],
    "axiom_nodes": [],
    "coherence_score": {},
    "fruits": {},
    "lean4": {},
    "master_equation": {},
    "paper_grader": {},
    "stories": {}
  },
  "classification": {
    "type": ["argument"],
    "domain": ["theology"],
    "register": ["THEOLOGICAL"]
  },
  "canon_status": "candidate",
  "truth_predicates": [],
  "atoms_produced": []
}
